{
  "handoff_id": "hp-20260617-skill-registry-init",
  "reviewer_id": "anthropic_claude_subscription",
  "created": "2026-06-17T15:00:00.000Z",
  "quality_state": "accepted",
  "score_by_dimension": {
    "task_fit": 100,
    "instruction_following": 100,
    "source_grounding": 95,
    "format_contract": 100,
    "verification_readiness": 100
  },
  "next_action": "Merge docs/autopilot/skill-registry.json. File adoption record. Proceed to Wave 4 Set A tasks (CX-09, CX-11, CX-13, CX-14, CX-15, CX-16 — parallelisable).",
  "verified_facts": [
    "docs/autopilot/skill-registry.json created with schemaVersion v1",
    "File structure: lastUpdatedAt, schemaVersion, skills: [], usageRecords: [], replacementCandidates: []",
    "No TypeScript files modified",
    "No existing files edited",
    "verify_result: pass — npm.cmd run verify returned exit 0 (214 unit tests, 4 Playwright)",
    "handoff_id hp-20260617-skill-registry-init present in handoff packet, worker output, and reviewer output",
    "No raw prompts, raw commands, secrets, or customer data in any artifact"
  ],
  "risks": [
    "CX-15 TypeScript types not yet created — skill-registry.json will be untyped until Wave 4 CX-15",
    "lastUpdatedAt is hardcoded to 2026-06-17T14:45:00.000Z — Wave 4 CX-15 should write this dynamically"
  ]
}
